{
  "$schema": "https://json-schema.org/draft/2020-12/schema",
  "$id": "https://playbook.dev/schemas/lane-state.schema.json",
  "title": "Lane State Artifact",
  "description": "Deterministic proposal-only lane readiness and dependency state derived from a workset plan.",
  "type": "object",
  "additionalProperties": false,
  "required": [
    "schemaVersion",
    "kind",
    "generatedAt",
    "proposalOnly",
    "workset_plan_path",
    "lanes",
    "blocked_lanes",
    "ready_lanes",
    "running_lanes",
    "completed_lanes",
    "merge_ready_lanes",
    "dependency_status",
    "merge_readiness",
    "verification_status",
    "warnings"
  ],
  "properties": {
    "schemaVersion": {
      "type": "string",
      "const": "1.0"
    },
    "kind": {
      "type": "string",
      "const": "lane-state"
    },
    "generatedAt": {
      "type": "string",
      "format": "date-time"
    },
    "proposalOnly": {
      "type": "boolean",
      "const": true
    },
    "workset_plan_path": {
      "type": "string",
      "minLength": 1
    },
    "lanes": {
      "type": "array",
      "items": {
        "$ref": "#/$defs/laneStateEntry"
      }
    },
    "blocked_lanes": {
      "type": "array",
      "items": {
        "type": "string",
        "minLength": 1
      },
      "uniqueItems": true
    },
    "ready_lanes": {
      "type": "array",
      "items": {
        "type": "string",
        "minLength": 1
      },
      "uniqueItems": true
    },
    "running_lanes": {
      "type": "array",
      "items": {
        "type": "string",
        "minLength": 1
      },
      "uniqueItems": true
    },
    "completed_lanes": {
      "type": "array",
      "items": {
        "type": "string",
        "minLength": 1
      },
      "uniqueItems": true
    },
    "dependency_status": {
      "type": "object",
      "additionalProperties": false,
      "required": [
        "total_edges",
        "satisfied_edges",
        "unsatisfied_edges"
      ],
      "properties": {
        "total_edges": {
          "type": "integer",
          "minimum": 0
        },
        "satisfied_edges": {
          "type": "integer",
          "minimum": 0
        },
        "unsatisfied_edges": {
          "type": "integer",
          "minimum": 0
        }
      }
    },
    "merge_readiness": {
      "type": "object",
      "additionalProperties": false,
      "required": [
        "merge_ready_lanes",
        "not_merge_ready_lanes"
      ],
      "properties": {
        "merge_ready_lanes": {
          "type": "array",
          "items": {
            "type": "string",
            "minLength": 1
          },
          "uniqueItems": true
        },
        "not_merge_ready_lanes": {
          "type": "array",
          "items": {
            "type": "object",
            "additionalProperties": false,
            "required": [
              "lane_id",
              "reasons"
            ],
            "properties": {
              "lane_id": {
                "type": "string",
                "minLength": 1
              },
              "reasons": {
                "type": "array",
                "items": {
                  "type": "string",
                  "minLength": 1
                },
                "uniqueItems": true
              }
            }
          }
        }
      }
    },
    "verification_status": {
      "type": "object",
      "additionalProperties": false,
      "required": [
        "status",
        "lanes_pending_verification",
        "lanes_blocked_from_verification"
      ],
      "properties": {
        "status": {
          "type": "string",
          "enum": [
            "pending",
            "blocked"
          ]
        },
        "lanes_pending_verification": {
          "type": "array",
          "items": {
            "type": "string",
            "minLength": 1
          },
          "uniqueItems": true
        },
        "lanes_blocked_from_verification": {
          "type": "array",
          "items": {
            "type": "string",
            "minLength": 1
          },
          "uniqueItems": true
        }
      }
    },
    "warnings": {
      "type": "array",
      "items": {
        "type": "string",
        "minLength": 1
      },
      "uniqueItems": true
    },
    "merge_ready_lanes": {
      "type": "array",
      "items": {
        "type": "string",
        "minLength": 1
      },
      "uniqueItems": true
    }
  },
  "$defs": {
    "laneStateEntry": {
      "type": "object",
      "additionalProperties": false,
      "required": [
        "lane_id",
        "task_ids",
        "status",
        "readiness_status",
        "dependency_level",
        "dependencies_satisfied",
        "blocked_reasons",
        "blocking_reasons",
        "conflict_surface_paths",
        "shared_artifact_risk",
        "assignment_confidence",
        "verification_summary",
        "merge_ready",
        "worker_ready",
        "protected_doc_consolidation"
      ],
      "properties": {
        "lane_id": {
          "type": "string",
          "minLength": 1
        },
        "task_ids": {
          "type": "array",
          "items": {
            "type": "string",
            "minLength": 1
          },
          "uniqueItems": true
        },
        "status": {
          "type": "string",
          "enum": [
            "blocked",
            "ready",
            "running",
            "completed",
            "merge_ready"
          ]
        },
        "readiness_status": {
          "type": "string",
          "enum": [
            "ready",
            "blocked"
          ]
        },
        "dependency_level": {
          "type": "string",
          "enum": [
            "low",
            "medium",
            "high"
          ]
        },
        "dependencies_satisfied": {
          "type": "boolean"
        },
        "blocked_reasons": {
          "type": "array",
          "items": {
            "type": "string",
            "minLength": 1
          },
          "uniqueItems": true
        },
        "blocking_reasons": {
          "type": "array",
          "items": {
            "type": "string",
            "minLength": 1
          },
          "uniqueItems": true
        },
        "conflict_surface_paths": {
          "type": "array",
          "items": {
            "type": "string",
            "minLength": 1
          },
          "uniqueItems": true
        },
        "shared_artifact_risk": {
          "type": "string",
          "enum": [
            "low",
            "medium",
            "high"
          ]
        },
        "assignment_confidence": {
          "type": "number",
          "minimum": 0,
          "maximum": 1
        },
        "verification_summary": {
          "type": "object",
          "additionalProperties": false,
          "required": [
            "status",
            "required_checks",
            "optional_checks",
            "notes"
          ],
          "properties": {
            "status": {
              "type": "string",
              "enum": [
                "pending",
                "blocked"
              ]
            },
            "required_checks": {
              "type": "array",
              "items": {
                "type": "string",
                "minLength": 1
              },
              "uniqueItems": true
            },
            "optional_checks": {
              "type": "array",
              "items": {
                "type": "string",
                "minLength": 1
              },
              "uniqueItems": true
            },
            "notes": {
              "type": "array",
              "items": {
                "type": "string",
                "minLength": 1
              },
              "uniqueItems": true
            }
          }
        },
        "merge_ready": {
          "type": "boolean"
        },
        "worker_ready": {
          "type": "boolean"
        },
        "protected_doc_consolidation": {
          "type": "object",
          "additionalProperties": false,
          "required": [
            "has_protected_doc_work",
            "stage",
            "summary",
            "next_command"
          ],
          "properties": {
            "has_protected_doc_work": {
              "type": "boolean"
            },
            "stage": {
              "type": "string",
              "enum": [
                "not_applicable",
                "pending",
                "blocked",
                "plan_ready",
                "applied"
              ]
            },
            "summary": {
              "type": "string",
              "minLength": 1
            },
            "next_command": {
              "type": [
                "string",
                "null"
              ]
            }
          }
        }
      }
    }
  }
}
