{
  "schemaVersion": "1.0",
  "kind": "lane-state",
  "generatedAt": "1970-01-01T00:00:00.000Z",
  "proposalOnly": true,
  "workset_plan_path": ".playbook/workset-plan.json",
  "lanes": [
    {
      "lane_id": "lane-1",
      "task_ids": [
        "task-docs"
      ],
      "status": "ready",
      "readiness_status": "ready",
      "dependency_level": "low",
      "dependencies_satisfied": true,
      "blocked_reasons": [],
      "blocking_reasons": [],
      "conflict_surface_paths": [],
      "shared_artifact_risk": "low",
      "assignment_confidence": 0.94,
      "verification_summary": {
        "status": "pending",
        "required_checks": [
          "pnpm -r build",
          "pnpm test"
        ],
        "optional_checks": [
          "pnpm playbook contracts --json",
          "pnpm playbook docs audit --json"
        ],
        "notes": [
          "lane is ready for deterministic proposal-only start transition"
        ]
      },
      "merge_ready": false,
      "worker_ready": true,
      "protected_doc_consolidation": {
        "has_protected_doc_work": false,
        "stage": "not_applicable",
        "summary": "no protected-doc work",
        "next_command": null
      }
    }
  ],
  "blocked_lanes": [],
  "ready_lanes": [
    "lane-1"
  ],
  "running_lanes": [],
  "completed_lanes": [],
  "merge_ready_lanes": [],
  "dependency_status": {
    "total_edges": 0,
    "satisfied_edges": 0,
    "unsatisfied_edges": 0
  },
  "merge_readiness": {
    "merge_ready_lanes": [],
    "not_merge_ready_lanes": [
      {
        "lane_id": "lane-1",
        "reasons": [
          "lane has not reached merge_ready lifecycle state"
        ]
      }
    ]
  },
  "verification_status": {
    "status": "pending",
    "lanes_pending_verification": [
      "lane-1"
    ],
    "lanes_blocked_from_verification": []
  },
  "warnings": [
    "merge readiness is conservative and only true for safely completed lanes"
  ]
}
